,pmid,Abstract
1,38455695,"INTRODUCTION: Large-scale clinical studies for COVID-19 vaccines have shown the infection-preventing effect and short-term adverse effects. Some rare illnesses such as eosinophilia can develop following COVID-19 vaccinations.
CASE DESCRIPTION: We report a case of 65-year-old man with unexplained abdominal pain that developed 2 weeks after COVID-19 mRNA vaccination. The patient had received a second dose of COVID-19 mRNA vaccine and revealed eosinophilia at the first visit to our hospital. Eosinophil infiltration was observed in the lamina propria of the duodenum by a step biopsy. Montelukast 10 mg was administered as the initial treatment of eosinophilic gastroenteritis (EGE), and the abdominal pain was improved.
DISCUSSION: The strong influence of COVID-19 vaccination on the development of EGE remains unproven. Reports of eosinophilia following COVID-19 vaccination have discussed that COVID-19 mRNA vaccination triggered an eosinophilic response.
CONCLUSION: This case presented EGE that developed following COVID-19 mRNA vaccination, which would be a rare adverse event.
LEARNING POINTS: Eosinophilia can develop following COVID-19 mRNA vaccination.To evaluate the relationships of these illnesses with vaccination, clinicians should collect information on vaccinations history and vaccination dates through interviews.It is clinically practical to know the differential diseases that may develop after a new vaccination."
2,38455062,"BACKGROUND: SARS-CoV-2 vaccination in rheumatoid arthritis (RA) patients treated with B cell-depleting drugs induced limited seroconversion but robust cellular response. We aimed to document specific T and B cell immunity in response to vaccine booster doses and breakthrough infection (BTI).
METHODS: We included 76 RA patients treated with rituximab who received up to four SARS-CoV-2 vaccine doses or three doses plus BTI, in addition to vaccinated healthy donors (HD) and control patients treated with tumor necrosis factor inhibitor (TNFi). We quantified anti-SARS-CoV-2 receptor-binding domain (RBD) Spike IgG, anti-nucleocapsid (NC) IgG, 92 circulating inflammatory proteins, Spike-binding B cells, and Spike-specific T cells along with comprehensive high-dimensional phenotyping and functional assays.
FINDINGS: The time since the last rituximab infusion, persistent inflammation, and age were associated with the anti-SARS-CoV-2 RBD IgG seroconversion. The vaccine-elicited serological response was accompanied by an incomplete induction of peripheral Spike-specific memory B cells but occurred independently of T cell responses. Vaccine- and BTI-elicited cellular immunity was similar between RA and HD 
INTERPRETATION: SARS-CoV-2 vaccination in RA can induce persistent effector T-cell responses that are reactivated by BTI. Paused rituximab medication allowed serological responses after a booster dose (D4), especially in RA with lower inflammation, enabling efficient humoral and cellular immunity after BTI, and contributed overall to the development of potential durable immunity."
3,38454762,"BACKGROUND: The unexpected detection of axillary lymphadenopathy (AxL) in cancer patients (pts) represents a real concern during the COVID-19 vaccination era. Benign reactions may take place after vaccine inoculation, which can mislead image interpretation in patients undergoing F-18-FDG, F-18-Choline, and Ga-68-DOTATOC PET/CT. They may also mimic loco-regional metastases or disease. We assessed PET/CT findings after COVID-19 first dose vaccination in cancer patients and the impact on their disease course management.
METHODS: We evaluated 333 patients undergoing PET/CT (257 F-18-FDG, 54 F-18-Choline, and 23 Ga-68 DOTATOC) scans after the first vaccination with mRNA vaccine (Pfizer-BioNTech) (study group; SG). The uptake index (SUVmax) of suspected AxL was defined as significant when the ratio was >1.5 as compared to the contralateral lymph nodes. Besides, co-registered CT (Co-CT) features of target lymph nodes were evaluated. Nodes with aggregate imaging positivity were further investigated.
RESULTS: Overall, the prevalence of apparently positive lymph nodes on PET scans was 17.1% during the vaccination period. 107 pts of the same setting, who had undergone PET/CT before the COVID-19 pandemic, represented the control group (CG). Only 3 patients of CG showed reactive lymph nodes with a prevalence of 2.8% (p < 0.001 as compared to the vaccination period). 84.2% of SG patients exhibited benign characteristics on co-CT images and only 9 pts needed thorough appraisal.
CONCLUSION: The correct interpretation of images is crucial to avoid unnecessary treatments and invasive procedures in vaccinated cancer pts. A detailed anamnestic interview and the analysis of lymph nodes' CT characteristics, after performing PET/CT, may help to clear any misleading diagnosis."
4,38454385,"BACKGROUND: The emergence of new SARS-CoV-2 variants and the waning of immunity raise concerns about vaccine effectiveness and protection against COVID-19. While antibody response has been shown to correlate with the risk of infection with the original variant and earlier variants of concern, the effectiveness of antibody-mediated protection against Omicron and the factors associated with protection remain uncertain.
METHODS: We evaluated antibody responses to SARS-CoV-2 spike (S) and nucleocapsid (N) antigens from Wuhan and variants of concern by Luminex and their role in preventing breakthrough infections 1 year after a third dose of mRNA vaccination, in a cohort of health care workers followed since the pandemic onset in Spain (N = 393). Data were analyzed in relation to COVID-19 history, demographic factors, comorbidities, vaccine doses, brand, and adverse events.
RESULTS: Higher levels of anti-S IgG and IgA to Wuhan, Delta, and Omicron were associated with protection against vaccine breakthroughs (IgG against Omicron S antigen HR, 0.06, 95%CI, 0.26-0.01). Previous SARS-CoV-2 infection was positively associated with antibody levels and protection against breakthroughs, and a longer time since last infection was associated with lower protection. In addition, priming with BNT162b2 followed by mRNA-1273 booster was associated with higher antibody responses than homologous mRNA-1273 vaccination.
CONCLUSIONS: Data show that IgG and IgA induced by vaccines against the original strain or by hybrid immunization are valid correlates of protection against Omicron BA.1 despite immune escape and support the benefits of heterologous vaccination regimens to enhance antibodies and the prioritization of booster vaccination in individuals without recent infections."
5,38454077,"There is currently limited data on the effectiveness of COVID-19 vaccines for children aged 6-11 years in Malaysia. This study aims to determine vaccine effectiveness (VE) against COVID-19-related hospitalization after receipt of one- and two-doses of BNT162b2 mRNA (Comirnaty-Pfizer/BioNTech) vaccine over a duration of almost 1 year in the predominantly Omicron period of BA.4/BA.5 and X.B.B sub lineages. This study linked administrative databases between May 2022 and March 2023 to evaluate real-world vaccine effectiveness (VE) for the BNT162b2 mRNA (Comirnaty-Pfizer/BioNTech) vaccine against COVID-19-related hospitalization in the Omicron pre-dominant period with BA.4/BA.5 and X.B.B sub lineages. During the Omicron-predominant period, the cumulative hospitalization rate was almost two times higher for unvaccinated children (9.6 per million population) compared to vaccinated children (6 per million population). The estimated VE against COVID-19 hospitalization for one dose of BNT162b2 was 27% (95% CI - 1%, 47%) and 38% (95% CI 27%, 48%) for two doses. The estimated VE against hospitalization remained stable when stratified by time. VE for the first 90 days was estimated to be 45% (95% CI 33, 55%), followed by 47% (95% CI 34, 56%) between 90 and 180 days, and 36% (95% CI 22, 45%) between 180 and 360 days. Recent infection within 6 months does not appear to modify the impact of vaccination on the risk of hospitalization, subject to the caveat of potential underestimation. In our pediatric population, BNT162b2 provided moderate-non-diminishing protection against COVID-19 hospitalization over almost 1 year of Omicron predominance."
6,38452271,"Lipid nanoparticles (LNPs), a nonviral nucleic acid delivery system, have shown vast potential for vaccine development and disease treatment. LNPs assist mRNA to cross physiological barriers such as cell membranes and endosomes/lysosomes, promoting the intracellular presentation of mRNA. However, the endosome escape efficiency and biosafety of currently commercialized LNPs are still unsatisfactory, resulting in underutilization of mRNA. Herein, we report that fluorinated modification of the 1,2-distearoyl-"
7,38452071,Strategy of using multiple mRNA shots to hone powerful antibodies hits a pothole.
8,38452010,"In the United States, most real-world estimates of COVID-19 vaccine effectiveness are based on data drawn from large health systems or sentinel populations. More data is needed to understand how the benefits of vaccination may vary across US populations with disparate risk profiles and policy contexts. We aimed to provide estimates of mRNA COVID-19 vaccine effectiveness against moderate and severe outcomes of COVID-19 based on state population-level data sources. Using statewide integrated administrative and clinical data and a test-negative case-control study design, we assessed mRNA COVID-19 vaccine effectiveness against SARS-CoV-2-related hospitalizations and emergency department visits among adults in South Carolina. We presented estimates of vaccine effectiveness at discrete time intervals for adults who received one, two or three doses of mRNA COVID-19 vaccine compared to adults who were unvaccinated. We also evaluated changes in vaccine effectiveness over time (waning) for the overall sample and in subgroups defined by age. We showed that while two doses of mRNA COVID-19 vaccine were initially highly effective, vaccine effectiveness waned as time elapsed since the second dose. Compared to protection against hospitalizations, protection against emergency department visits was found to wane more sharply. In all cases, a third dose of mRNA COVID-19 vaccine conferred significant gains in protection relative to waning protection after two doses. Further, over more than 120 days of follow-up, the data revealed relatively limited waning of vaccine effectiveness after a third dose of mRNA COVID-19 vaccine."
9,38450722,"Over the past year, an unexpected surge in human monkeypox (hMPX) cases has been observed. This outbreak differs from previous ones, displaying distinct epidemiological characteristics and transmission patterns, believed to be influenced by a newly emerging monkeypox virus (MPXV) lineage. Notably, this emerging MPXV lineage has exhibited several non-synonymous mutations, some of which are linked to immunomodulatory activities and antigenic characteristics that aid in host detection. However, specific treatments or vaccines for human monkeypox are currently lacking. Hence, we aim to develop a multi-epitope mRNA vaccine by using immunoinformatics approaches against the MPXV, particularly its emerging variants. Six proteins (A29L, A35R, B6R, M1R, H3L, and E8L) were chosen for epitope and mutation site identification. Seventeen top-performing epitopes and eight epitopes containing mutation sites were selected and combined with adjuvants, the PADRE sequence, and linkers for vaccine development. The molecular and physical properties of the designed vaccine (WLmpx) were favorable. Immunological characteristics of WLmpx were assessed through molecular docking, molecular dynamics (MD) simulations, and immune simulations. Finally, the vaccine sequence was utilized to formulate an mRNA-based vaccine. The informatics-based predicted results indicated that the designed vaccine exhibits significant potential in eliciting high-level humoral and cellular immune responses, but further validation through "
0,38451822,"It is hoped that artificial enzymes designed in laboratories can be efficient alternatives to chemical catalysts that have been used to synthesize organic molecules. However, the design of artificial enzymes is challenging and requires a detailed molecular-level analysis to understand the mechanism they promote in order to design efficient variants. In this study, we computationally investigate the mechanism of proficient Morita-Baylis-Hillman enzymes developed using a combination of computational design and directed evolution. The powerful transition path sampling method coupled with in-depth post-processing analysis has been successfully used to elucidate the different chemical pathways, transition states, protein dynamics, and free energy barriers of reactions catalyzed by such laboratory-optimized enzymes. This research provides an explanation for how different chemical modifications in an enzyme affect its catalytic activity in ways that are not predictable by static design algorithms."
1,38438341,"Directed evolution of computationally designed enzymes has provided new insights into the emergence of sophisticated catalytic sites in proteins. In this regard, we have recently shown that a histidine nucleophile and a flexible arginine can work in synergy to accelerate the Morita-Baylis-Hillman (MBH) reaction with unrivalled efficiency. Here, we show that replacing the catalytic histidine with a non-canonical N"
2,38434363,"The COVID-19 pandemic, caused by severe acute respiratory syndrome coronavirus 2 (SARS-CoV-2), emerged in 2019 following prior outbreaks of coronaviruses like SARS and MERS in recent decades, underscoring their high potential of infectivity in humans. Insights from previous outbreaks of SARS and MERS have played a significant role in developing effective strategies to mitigate the global impact of SARS-CoV-2. As of January 7, 2024, there have been 774,075,242 confirmed cases of COVID-19 worldwide. To date, 13.59 billion vaccine doses have been administered, and there have been 7,012,986 documented fatalities (https://www.who.int/) Despite significant progress in addressing the COVID-19 pandemic, the rapid evolution of SARS-CoV-2 challenges human defenses, presenting ongoing global challenges. The emergence of new SARS-CoV-2 lineages, shaped by mutation and recombination processes, has led to successive waves of infections. This scenario reveals the need for next-generation vaccines as a crucial requirement for ensuring ongoing protection against SARS-CoV-2. This demand calls for formulations that trigger a robust adaptive immune response without leading the acute inflammation linked with the infection. Key mutations detected in the Spike protein, a critical target for neutralizing antibodies and vaccine design -specifically within the Receptor Binding Domain region of Omicron variant lineages (B.1.1.529), currently dominant worldwide, have intensified concerns due to their association with immunity evasion from prior vaccinations and infections. As the world deals with this evolving threat, the narrative extends to the realm of emerging variants, each displaying new mutations with implications that remain largely misunderstood. Notably, the JN.1 Omicron lineage is gaining global prevalence, and early findings suggest it stands among the immune-evading variants, a characteristic attributed to its mutation L455S. Moreover, the detrimental consequences of the novel emergence of SARS-CoV-2 lineages bear a particularly critical impact on immunocompromised individuals and older adults. Immunocompromised individuals face challenges such as suboptimal responses to COVID-19 vaccines, rendering them more susceptible to severe disease. Similarly, older adults have an increased risk of severe disease and the presence of comorbid conditions, find themselves at a heightened vulnerability to develop COVID-19 disease. Thus, recognizing these intricate factors is crucial for effectively tailoring public health strategies to protect these vulnerable populations. In this context, this review aims to describe, analyze, and discuss the current progress of the next-generation treatments encompassing immunotherapeutic approaches and advanced therapies emerging as complements that will offer solutions to counter the disadvantages of the existing options. Preliminary outcomes show that these strategies target the virus and address the immunomodulatory responses associated with COVID-19. Furthermore, the capacity to promote tissue repair has been demonstrated, which can be particularly noteworthy for immunocompromised individuals who stand as vulnerable actors in the global landscape of coronavirus infections. The emerging next-generation treatments possess broader potential, offering protection against a wide range of variants and enhancing the ability to counter the impact of the constant evolution of the virus. Furthermore, advanced therapies are projected as potential treatment alternatives for managing Chronic Post-COVID-19 syndromeand addressing its associated long-term complications."
3,38430575,"Targeting metalloproteinases (MPs) has been the center of attention for developing therapeutics due to their contribution to a wide range of diseases, including cancer, cardiovascular, neurodegenerative disease, and preterm labor. Protein-based MP inhibitors offer higher stability and selectivity, which is critical for developing efficient therapeutics with low off-target effects. Tissue inhibitors of metalloproteinases (TIMPs), natural inhibitors of MPs, and antibodies provide excellent protein scaffolds for engineering selective or multispecific MP inhibitors. Advances in protein engineering and design techniques, such as rational design and directed evolution using yeast display to develop potent MP inhibitors, are discussed, including but not limited to loop grafting, swapping, and counterselective selection."
4,38428504,"Emerging consumer demand for safer, more sustainable flavors and fragrances has created new challenges for the industry. Enzymatic syntheses represent a promising green production route, but the broad application requires engineering advancements for expanded diversity, improved selectivity, and enhanced stability to be cost-competitive with current methods. This review discusses recent advances and future outlooks for enzyme engineering in this field. We focus on carboxylic acid reductases (CARs) and unspecific peroxygenases (UPOs) that enable selective productions of complex flavor and fragrance molecules. Both enzyme types consist of natural variants with attractive characteristics for biocatalytic applications. Applying protein engineering methods, including rational design and directed evolution in concert with computational modeling, present excellent examples for property improvements to unleash the full potential of enzymes in the biosynthesis of value-added chemicals."
5,38428393,"Chloroplasts are green plastids in the cytoplasm of eukaryotic algae and plants responsible for photosynthesis. The plastid-encoded RNA polymerase (PEP) plays an essential role during chloroplast biogenesis from proplastids and functions as the predominant RNA polymerase in mature chloroplasts. The PEP-centered transcription apparatus comprises a bacterial-origin PEP core and more than a dozen eukaryotic-origin PEP-associated proteins (PAPs) encoded in the nucleus. Here, we determined the cryo-EM structures of Nicotiana tabacum (tobacco) PEP-PAP apoenzyme and PEP-PAP transcription elongation complexes at near-atomic resolutions. Our data show the PEP core adopts a typical fold as bacterial RNAP. Fifteen PAPs bind at the periphery of the PEP core, facilitate assembling the PEP-PAP supercomplex, protect the complex from oxidation damage, and likely couple gene transcription with RNA processing. Our results report the high-resolution architecture of the chloroplast transcription apparatus and provide the structural basis for the mechanistic and functional study of transcription regulation in chloroplasts."
6,38414298,"An urgent need for effective surveillance strategies arose due to the global emergence of the severe acute respiratory syndrome coronavirus 2 (SARS-CoV-2). Although vaccines and antivirals are available, concerns persist about the evolution of new variants with potentially increased infectivity, transmissibility, and immune evasion. Therefore, variant monitoring is crucial for public health decision-making. Wastewater-based surveillance has proven to be an effective tool to monitor SARS-CoV-2 variants within populations. Specific SARS-CoV-2 variants are detected and quantified in wastewater in this study using a reverse transcriptase digital droplet polymerase chain reaction (RT-ddPCR) approach. The 11 designed assays were first validated in silico using a substantial dataset of high-quality SARS-CoV-2 genomes to ensure comprehensive variant coverage. The assessment of the sensitivity and specificity with reference material showed the capability of the developed assays to reliably identify target mutations while minimizing false positives and false negatives. The applicability of the assays was evaluated using wastewater samples from a wastewater treatment plant in Ghent, Belgium. The quantification of the specific mutations linked to the variants of concern present in these samples was calculated using these assays based on the detection of single mutations, which confirms their use for real-world variant surveillance. In conclusion, this study provides an adaptable protocol to monitor SARS-CoV-2 variants in wastewater with high sensitivity and specificity. Its potential for broader application in other viral surveillance contexts highlights its added value for rapid response to emerging infectious diseases. PRACTITIONER POINTS: Robust RT-ddPCR methodology for specific SARS-CoV-2 variants of concern detection in wastewater. Rigorous validation that demonstrates high sensitivity and specificity. Demonstration of real-world applicability using wastewater samples. Valuable tool for rapid response to emerging infectious diseases."
7,38413010,"Biomolecular research traditionally revolves around comprehending the mechanisms through which peptides or proteins facilitate specific functions, often driven by their relevance to clinical ailments. This conventional approach assumes that unraveling mechanisms is a prerequisite for wielding control over functionality, which stands as the ultimate research goal. However, an alternative perspective emerges from physics-based inverse design, shifting the focus from mechanisms to the direct acquisition of functional control strategies. By embracing this methodology, we can uncover solutions that might not have direct parallels in natural systems, yet yield crucial insights into the isolated molecular elements dictating functionality. This provides a distinctive comprehension of the underlying mechanisms.In this context, we elucidate how physics-based inverse design, facilitated by evolutionary algorithms and coarse-grained molecular simulations, charts a promising course for innovating the reverse engineering of biopolymers interacting with intricate fluid phases such as lipid membranes and liquid protein phases. We introduce evolutionary molecular dynamics (Evo-MD) simulations, an approach that merges evolutionary algorithms with the Martini coarse-grained force field. This method directs the evolutionary process from random amino acid sequences toward peptides interacting with complex fluid phases such as biological lipid membranes, offering significant promises in the development of peptide-based sensors and drugs. This approach can be tailored to recognize or selectively target specific attributes such as membrane curvature, lipid composition, membrane phase (e.g., lipid rafts), and protein fluid phases. Although the resulting optimal solutions may not perfectly align with biological norms, physics-based inverse design excels at isolating relevant physicochemical principles and thermodynamic driving forces governing optimal biopolymer interaction within complex fluidic environments. In addition, we expound upon how physics-based evolution using the Evo-MD approach can be harnessed to extract the evolutionary optimization fingerprints of protein-lipid interactions from native proteins. Finally, we outline how such an approach is uniquely able to generate strategic training data for predictive neural network models that cover the whole relevant physicochemical domain. Exploring challenges, we address key considerations such as choosing a fitting fitness function to delineate the desired functionality. Additionally, we scrutinize assumptions tied to system setup, the targeted protein structure, and limitations posed by the utilized (coarse-grained) force fields and explore potential strategies for guiding evolution with limited experimental data. This discourse encapsulates the potential and remaining obstacles of physics-based inverse design, paving the way for an exciting frontier in biomolecular research."
8,38363837,"Netrins dictate attractive and repulsive responses during axon growth and cell migration, where the presence of the receptor Uncoordinated-5 (UNC-5) on target cells results in repulsion. Here, we showed that UNC-5 is a heparin-binding protein, determined its structure bound to a heparin fragment, and could modulate UNC-5-heparin affinity using a directed evolution platform or structure-based rational design. We demonstrated that UNC-5 and UNC-6/netrin form a large, stable, and rigid complex in the presence of heparin, and heparin and UNC-5 exclude the attractive UNC-40/DCC receptor from binding to UNC-6/netrin to a large extent. "
